{
  "schema_version": "fightbox.fixture.v1",
  "fixture_id": "s4-masonry-street-canyon",
  "gate": "S3",
  "coordinate_frame": {"name": "local_enu", "units": "meters_seconds", "axes": "x_east_y_north_z_up", "steam_audio_mapping": "steam_x=enu_x;steam_y=enu_z;steam_z=-enu_y"},
  "kernel": {"name": "Steam Audio", "version": "4.8.1"},
  "source": {"id": "canyon-source", "position_m": [0,-4,1.5], "reference_level": {"mode": "SplAtOneMeter", "db_spl": 85}, "asset_id": "s3-calibrated-pink"},
  "listener": {"position_m": [0,1,1.5], "forward_enu": [0,1,0], "up_enu": [0,0,1]},
  "geometry": {
    "vertices_m": [[-1.75,-10,0],[-1.75,10,0],[-1.75,10,8],[-1.75,-10,8],[1.75,-10,0],[1.75,10,0],[1.75,10,8],[1.75,-10,8]],
    "triangles": [
      {"indices":[0,1,2],"material":"masonry"},{"indices":[0,2,3],"material":"masonry"},{"indices":[2,1,0],"material":"masonry"},{"indices":[3,2,0],"material":"masonry"},
      {"indices":[4,7,6],"material":"masonry"},{"indices":[4,6,5],"material":"masonry"},{"indices":[6,7,4],"material":"masonry"},{"indices":[5,6,4],"material":"masonry"},
      {"indices":[0,4,5],"material":"ground"},{"indices":[0,5,1],"material":"ground"},{"indices":[5,4,0],"material":"ground"},{"indices":[1,5,0],"material":"ground"}
    ],
    "materials": {
      "masonry": {"absorption": [0.03,0.05,0.07], "scattering": 0.18, "transmission": [0,0,0]},
      "ground": {"absorption": [0.05,0.07,0.08], "scattering": 0.08, "transmission": [0,0,0]}
    }
  },
  "simulation": {
    "direct": {"distance_attenuation": true, "occlusion": true, "occlusion_samples": 64},
    "reflections": {"enabled": true, "rays": 8192, "bounces": 6, "duration_s": 0.6},
    "pathing": {"enabled": true, "order": 2, "validation": true, "alternate_paths": true, "runtime_order": ["direct","path","reflections"]},
    "probe_volume": {"type": "box", "min_m": [-1.25,-9,0.25], "max_m": [1.25,9,2.75], "spacing_m": 1.5},
    "probe_generation": {"type": "uniform_floor", "height_m": 1.5},
    "path_bake": {"identifier": "s4-canyon-path-bake-v1", "required_call": "iplPathBakerBake", "probe_batch_serialization": "required", "fresh_process_reload": true, "bake_order": 2}
  },
  "expected": {
    "properties": [
      "The street is 3.5 m wide between parallel 8 m masonry faces and remains open at both ends and above.",
      "The indirect binaural response has lower IACC and higher reflection density than a one-face slapback control."
    ],
    "non_claims": [
      "The fixture's S3 schema tag is a compatibility encoding because the frozen shared fixture schema predates S4; fixture_id and expected properties carry the S4 authority.",
      "The automated spaciousness regime is a bounded proxy and does not replace the later human listening record."
    ]
  }
}
